scholarship_id,university_id,name,level,eligibility,award_type,award_value,currency,deadline,requirements,description,url
S_UK025_02,UK025,Edinburgh Napier International Merit Scholarship,PG,International (Non-EU) fee status,Tuition Reduction,1000.00-2000.00,GBP,2026-07-31,"Admission to a full-time taught Master’s degree; minimum 2:1 honors degree or equivalent; self-funding status; automatic assessment during the admissions process; excluded for certain MBA and specialist clinical programs.","This merit scholarship provides international postgraduates with a one-off reduction in their tuition fees. It recognizes prior academic achievement and supports talented graduates in transitioning to specialized studies in business, computing, and the creative industries.","https://www.napier.ac.uk"
S_UK026_01,UK026,Falmouth International Excellence Scholarship,UG,International (Non-EU) fee status,Tuition Reduction,5000.00,GBP,2026-05-15,"Must hold an offer for a full-time undergraduate degree; submission of a 500-word statement on creative aspirations; academic achievement equivalent to BBB at A-Level; must be an international fee payer.","A high-value award for exceptional creative talent. This scholarship provides a £5,000 reduction in the first year of tuition to support the most promising international artists, designers, and performers joining Falmouth's creative community.","https://www.falmouth.ac.uk"
S_UK027_01,UK027,GCU New to GCU Scholarship,UG,International (Non-EU) fee status,Tuition Reduction,2000.00,GBP,2026-07-01,"Available to new self-funding international students; must have accepted a firm offer for a full-time undergraduate degree; awarded automatically to students who meet the academic entry requirements.","An automatic tuition fee reduction designed to welcome international students to Glasgow. This award provides £2,000 off the first year of study for those joining the University for the Common Good across business, engineering, and health.","https://www.gcu.ac.uk"
S_UK027_02,UK027,GCU New to GCU Scholarship,PG,International (Non-EU) fee status,Tuition Reduction,2000.00,GBP,2026-08-01,"Hold an offer for a full-time taught Master’s; minimum 2:1 degree or international equivalent; must be self-funding; automatic assessment upon admission; available for January and September 2026 intakes.","A merit-based award for international postgraduates, providing a £2,000 one-off discount on the total tuition fee. It supports talented graduates in pursuing advanced studies at GCU's Glasgow or London campuses.","https://www.gcu.ac.uk"
S_UK028_01,UK028,Goldsmiths International Scholarship,UG,International (Non-EU) fee status,Tuition Reduction,2000.00-5000.00,GBP,2026-05-24,"Must be an international fee-paying student; hold an offer for a full-time undergraduate degree; separate application including a personal statement; merit-based selection focusing on academic and creative achievement.","Goldsmiths offers a range of scholarships to support international students from diverse backgrounds. These awards provide tiered tuition fee reductions to attract the world's most academically and creatively gifted students to New Cross.","https://www.gold.ac.uk"
S_UK028_02,UK028,Goldsmiths International Scholarship,PG,International (Non-EU) fee status,Tuition Reduction,2000.00-5000.00,GBP,2026-05-24,"Available to international postgraduate taught applicants; must hold a minimum 2:1 undergraduate degree; separate application required; excludes students receiving full government or employer sponsorship.","A prestigious award for international postgraduates aimed at fostering global academic exchange. The scholarship provides a significant reduction in Master's tuition fees for students who demonstrate high potential in humanities, social sciences, and the arts.","https://www.gold.ac.uk"
S_UK029_01,UK029,Harper Adams International Scholarship,UG,International (Non-EU) fee status,Tuition Reduction,2500.00,GBP,2026-06-30,"Must be an international fee-payer; hold an offer for an undergraduate degree in Agriculture, Food or Rural sectors; minimum academic requirements apply; selection based on academic merit and passion for the industry.","Recognizing the importance of global agriculture, this award supports international students entering Harper Adams. It provides a tuition fee reduction for the first year to encourage students to specialize in rural and agricultural innovation.","https://www.harper-adams.ac.uk"
S_UK030_01,UK030,Hartpury International Merit Scholarship,UG,International (Non-EU) fee status,Tuition Reduction,1000.00-3000.00,GBP,2026-05-31,"International fee payers only; must be entering a full-time undergraduate program; based on academic merit (equivalent to BBB or higher); automatic assessment at the point of offer for most programs.","This merit-based award supports international students pursuing degrees in equine, animal, and sports sciences. The scholarship provides a tiered reduction in the first year of tuition fees, recognizing high-performing students from across the globe.","https://www.hartpury.ac.uk"
S_UK030_02,UK030,Hartpury International Merit Scholarship,PG,International (Non-EU) fee status,Tuition Reduction,1000.00-2000.00,GBP,2026-06-30,"Hold an offer for a full-time taught Master’s degree; hold a minimum 2:1 degree or international equivalent; must be self-funding; automatic assessment upon admission for eligible candidates.","Designed to attract top postgraduate talent to Hartpury's research-active community. This award provides a one-off tuition fee reduction for international graduates specializing in animal behavior, sports coaching, or veterinary nursing.","https://www.hartpury.ac.uk"
