university_id,name,slug,country,city,overview,estimated_living_cost_annual,population,admission_requirements,acceptance_rate,graduation_rate,financial_aid,website,avg_ug_tuition,avg_pg_tuition,ranking,logo,banner
UK136,University of the Highlands and Islands,university-of-the-highlands-and-islands,UK,Inverness,"A unique federal university covering the Highlands and Islands of Scotland, specializing in adventure tourism and environment.",12500,10500,"UCAS 96-112; IELTS 6.0; Passion for rural/specialist study area.",88.0,81.0,"UHI International Student Scholarship; Regional bursaries.","https://www.uhi.ac.uk/en/",15500,16500,103,https://www.uhi.ac.uk/en/t4-media/one-web/university/admin-assets/img/logos/uhi-logo-reversed.png
UK137,University of the West of England,university-of-the-west-of-england,UK,Bristol,"A top modern university in Bristol known for industry partnerships, high employability, and creative technologies.",13500,28500,"UCAS 112-128; IELTS 6.0 (UG) / 6.5 (PG).",60.0,86.0,"UWE Bristol Vice-Chancellor's Scholarship (50% tuition reduction).","https://www.uwe.ac.uk/",16500,17500,61,https://www.uwe.ac.uk/assets/img/logo.svg
UK138,University of the West of Scotland,university-of-the-west-of-scotland,UK,Paisley,"A career-focused university with a strong emphasis on nursing, health, and engineering across five campuses.",12500,16000,"UCAS 96-112; IELTS 6.0 (min 5.5).",82.0,78.0,"UWS International Scholarship (£1,500); Global Reach Scholarship.","https://www.uws.ac.uk/",15500,16500,118,https://encrypted-tbn0.gstatic.com/images?q=tbn:ANd9GcRtDwWWVzbbUxvn0TVXpePy3m_DUVQRoZP93g&s
UK139,Ulster University,university-of-ulster,UK,Belfast,"A leading university in Northern Ireland with a major new Belfast city campus, specializing in business and health.",11500,25000,"ABB-BBB (UCAS 120-128); IELTS 6.0 (min 5.5).",75.0,88.0,"International Undergraduate Scholarship (£2,000 per year).","https://www.ulster.ac.uk/",17500,18500,38,https://www.ulster.ac.uk/__data/assets/git_bridge/0003/1705242/images/6764285d3728fcd6598ddf9d_ulster-university.svg
UK140,University of Wales Trinity St David,university-of-wales-trinity-st-david,UK,Swansea,"A historic university in Wales focused on applied learning in creative arts, engineering, and education.",12000,11500,"UCAS 88-104; IELTS 6.0; School leaving certificates.",86.0,80.0,"International Student Bursary (£1,000); Progression discounts.","https://www.uwtsd.ac.uk/",15000,16000,121,https://www.uwtsd.ac.uk/themes/custom/rutherford/images/logo.svg?t99w1x
UK141,University of Warwick,university-of-warwick,UK,Coventry,"A top-10 Russell Group university known for its elite business school (WBS), mathematics, and engineering.",13500,28500,"A*AA-AAA; IELTS 6.5-7.5 (min 6.5 in bands).",14.0,94.0,"Warwick Global Excellence Scholarship; WBS Merit Scholarships.","https://warwick.ac.uk/",26500,31500,9,https://d36jn9qou1tztq.cloudfront.net/static_war/render/id7/images/wordmark.svg.136055278947
UK142,University of Westminster,university-of-westminster,UK,London,"A global university in central London known for its media, fashion, and international relations departments.",17500,19500,"UCAS 104-120; IELTS 6.0 (UG) / 6.5 (PG).",65.0,82.0,"Westminster International Undergraduate Full Scholarship.","https://www.westminster.ac.uk/",16500,18000,105,https://encrypted-tbn0.gstatic.com/images?q=tbn:ANd9GcQmAJ-Ulphp_RX3Vs6X4JGBYOvkvUjbuEYu7A&s
UK143,University of Wolverhampton,university-of-wolverhampton,UK,Wolverhampton,"A modern university in the West Midlands with strong focus on teacher training, nursing, and digital arts.",12500,21500,"UCAS 88-104; IELTS 6.0; Relevant Level 3 background.",88.0,76.0,"Lord Paul Undergraduate Scholarship (£1,000 - £2,000).","https://www.wlv.ac.uk/",15500,16500,114,https://www.wlv.ac.uk/media/2019-template-assets/graphics/logo.svg
UK144,University of York,university-of-york,UK,York,"A prestigious Russell Group university known for its collegiate system and excellence in the arts and STEM.",12500,21000,"AAA-ABB (UCAS 128-144); IELTS 6.5 (min 6.0).",20.0,91.0,"Be Exceptional Scholarship (£2,500 - £7,500).","https://www.york.ac.uk/",21500,23500,17,https://www.york.ac.uk/static/2/images/uoy_logo_white.svg
UK145,Wrexham University,wrexham-university,UK,Wrexham,"A community-focused university in North Wales providing industry-aligned degrees with a focus on employability.",11500,5500,"UCAS 88-104; IELTS 6.0; School leaving certificates.",86.0,79.0,"International Student Scholarship; Welsh regional bursaries.","https://wrexham.ac.uk/",14500,15500,128,https://encrypted-tbn0.gstatic.com/images?q=tbn:ANd9GcQg5JG7D3tg_CJti-xpIaN5DuCsDCO3_GpRnw&s
UK146,York St John University,york-st-john-university,UK,York,"A historic university in the heart of York known for its high student satisfaction and inclusive community.",12500,7500,"UCAS 96-112; IELTS 6.0; Strong personal statement.",84.0,85.0,"York St John International Scholarship (£1,000 reduction).","https://www.yorksj.ac.uk/",15500,16000,90,https://studentconnect.org/uploads/institutions/652462774c0d9.png
UNIV_GLOBAL,Global Scholarships,global-scholarships,IE,Dublin,"State or national scholarships not tied to a single university.",0,0,"",0,0,"","",0,0,0